{
  "schema_version": "1.0",
  "role": "audit",
  "expected_cadence_minutes": 60,
  "expected_minute": 11,
  "last_attempt_at": null,
  "last_success_at": null,
  "last_status": "not_yet_recorded",
  "last_run_key": null,
  "consecutive_non_success": 0,
  "notes": "Initialized without fabricated liveness. The audit scheduled role owns future updates."
}
