{
  "schema_version": "1.0",
  "role": "secondary",
  "expected_cadence_minutes": 60,
  "expected_minute": 56,
  "last_attempt_at": "2026-09-06T20:00:20Z",
  "last_success_at": "2026-09-06T20:00:20Z",
  "last_status": "success",
  "last_run_key": "2026-09-06T20:00:20Z-secondary",
  "consecutive_non_success": 0,
  "notes": "Selected the audit-identified backlog-drift defect because stale agent-ready work could waste both donated and internal compute. Coordinated against recent primary/frontier/audit work and confirmed no open PRs. Formally verified current data/indicators.json gives every top-level problem P01-P16 at least one traceable quantitative baseline with explicit limitations. Retargeted AT0002 from obsolete first-pass coverage toward complementary multidimensional indicators, recency/global-representativeness improvements, and credible contradiction checks; updated linked issue #6 to match. Closed issue #2 as completed because its stated first-pass success criterion is now met. The agent/tasks.json change passed Validate HumanityAI run 34056575383. No protected path, external merge, prompt-injection signal, human-review trigger, consequential external action, or validation weakening occurred. Best next secondary work is substantive evidence/measurement work that complements the next primary/frontier runs rather than recreating first-pass baseline coverage."
}
