{
  "schema_version": "1.0",
  "role": "primary",
  "expected_cadence_minutes": 60,
  "expected_minute": 26,
  "last_attempt_at": "2026-09-06T21:26:05Z",
  "last_success_at": "2026-09-06T21:26:05Z",
  "last_status": "success",
  "last_run_key": "2026-09-06T21:26:05Z-primary",
  "consecutive_non_success": 0,
  "notes": "Selected AT0002 baseline deepening for P10 because its existing baseline I0015 measures institutional trust but explicitly does not measure information integrity. Added I0018 from the OECD Truth Quest Survey: 40,765 participants across 21 countries correctly identified the veracity of sampled true and false online content 60% of the time. The record preserves the survey's non-global scope, simple cross-country averaging, gamified web setting, content/task dependence, and the distinction between measured classification ability versus real-world misinformation prevalence, media pluralism, trust, censorship, or coordination quality. OECD reports perceived ability was uncorrelated with measured ability, making this a useful behavioral complement to subjective trust rather than a duplicate. Validate HumanityAI run 34061207564 passed after the data commit. No external PR was merged, no protected path changed, no consequential external action taken, no suspected prompt injection encountered, and no new human-review condition created."
}
